Keyword,Intent,Volume,Keyword Difficulty,CPC (GBP),SERP Features
azure virtual desktop specialty,,20,,5.17,
azure virtual desktop windows 11,,20,,4.76,
download azure virtual desktop client,,20,,4.17,
azure virtual desktop for mac,,20,,3.91,
azure virtual desktop web client,,40,,3.83,
microsoft azure virtual desktop,,30,,3.74,
ms azure virtual desktop,,10,,3.74,
azure virtual desktop on prem,,0,,3.67,
azure virtual desktop on premise,,20,,3.67,
access azure virtual desktop,,20,,3.58,
accessing azure virtual desktop,,10,,3.58,
azure virtual desktop avd,,20,,3.55,
azure virtual desktop workspace,,0,,3.47,
azure virtual desktop workspaces,,20,,3.47,
